{
  "$schema": "https://kelvinccho.github.io/marathon-race/data/milestones.schema.json",
  "schemaVersion": 1,
  "derivedFrom": "events.json",
  "checked": "2026-10-24",
  "publisher": "Marathon Race",
  "disclaimer": "Confirm every date on the official race site before you enter, pay, or book travel. Organisers change windows.",
  "milestoneTypes": [
    {
      "id": "ballot_open",
      "label": "Ballot opens",
      "color": "#0F6F6A"
    },
    {
      "id": "ballot_close",
      "label": "Ballot closes",
      "color": "#8A5300"
    },
    {
      "id": "result",
      "label": "Result",
      "color": "#5C4D8A"
    },
    {
      "id": "payment",
      "label": "Payment",
      "color": "#9D3D55"
    },
    {
      "id": "expo",
      "label": "Expo",
      "color": "#1E4F86"
    },
    {
      "id": "race",
      "label": "Race day",
      "color": "#A33B24"
    },
    {
      "id": "qualifier_open",
      "label": "Qualifier opens",
      "color": "#2D6A3E"
    },
    {
      "id": "qualifier_close",
      "label": "Qualifier closes",
      "color": "#1E4A2C"
    }
  ],
  "milestones": [
    {
      "eventId": "nyc-2026",
      "eventName": "TCS New York City Marathon",
      "shortName": "NYC",
      "edition": 2026,
      "series": "world_marathon_majors",
      "seriesStatus": "major",
      "order": 0,
      "entryState": "decided",
      "entryNoun": "drawing",
      "hasPublicBallot": true,
      "city": "New York",
      "region": "New York",
      "country": "United States",
      "countryCode": "US",
      "timeZone": "America/New_York",
      "raceDate": "2026-11-01",
      "raceEndDate": null,
      "officialUrl": "https://www.nyrr.org/tcsnycmarathon",
      "entryUrl": "https://www.nyrr.org/tcsnycmarathon",
      "path": "events/nyc-2026/",
      "milestoneId": "ballot-open",
      "type": "ballot_open",
      "label": "Drawing opens",
      "at": "2026-02-04T00:00:00-05:00",
      "end": null,
      "endLabel": null,
      "date": "2026-02-04",
      "endDate": null,
      "precision": "day",
      "confidence": "reported",
      "primary": true,
      "note": "The 2026 drawing ran from 4 February. The hour is not stored.",
      "sourceUrl": "https://www.nyrr.org/tcsnycmarathon"
    },
    {
      "eventId": "nyc-2026",
      "eventName": "TCS New York City Marathon",
      "shortName": "NYC",
      "edition": 2026,
      "series": "world_marathon_majors",
      "seriesStatus": "major",
      "order": 0,
      "entryState": "decided",
      "entryNoun": "drawing",
      "hasPublicBallot": true,
      "city": "New York",
      "region": "New York",
      "country": "United States",
      "countryCode": "US",
      "timeZone": "America/New_York",
      "raceDate": "2026-11-01",
      "raceEndDate": null,
      "officialUrl": "https://www.nyrr.org/tcsnycmarathon",
      "entryUrl": "https://www.nyrr.org/tcsnycmarathon",
      "path": "events/nyc-2026/",
      "milestoneId": "ballot-close",
      "type": "ballot_close",
      "label": "Drawing closes",
      "at": "2026-02-25T00:00:00-05:00",
      "end": null,
      "endLabel": null,
      "date": "2026-02-25",
      "endDate": null,
      "precision": "day",
      "confidence": "reported",
      "primary": true,
      "note": "The 2026 drawing closed on 25 February.",
      "sourceUrl": "https://www.nyrr.org/tcsnycmarathon"
    },
    {
      "eventId": "nyc-2026",
      "eventName": "TCS New York City Marathon",
      "shortName": "NYC",
      "edition": 2026,
      "series": "world_marathon_majors",
      "seriesStatus": "major",
      "order": 0,
      "entryState": "decided",
      "entryNoun": "drawing",
      "hasPublicBallot": true,
      "city": "New York",
      "region": "New York",
      "country": "United States",
      "countryCode": "US",
      "timeZone": "America/New_York",
      "raceDate": "2026-11-01",
      "raceEndDate": null,
      "officialUrl": "https://www.nyrr.org/tcsnycmarathon",
      "entryUrl": "https://www.nyrr.org/tcsnycmarathon",
      "path": "events/nyc-2026/",
      "milestoneId": "result",
      "type": "result",
      "label": "Drawing results",
      "at": "2026-03-04T00:00:00-05:00",
      "end": null,
      "endLabel": null,
      "date": "2026-03-04",
      "endDate": null,
      "precision": "day",
      "confidence": "reported",
      "primary": true,
      "note": "Results were released on 4 March 2026.",
      "sourceUrl": "https://www.nyrr.org/tcsnycmarathon"
    },
    {
      "eventId": "london-2027",
      "eventName": "TCS London Marathon",
      "shortName": "London",
      "edition": 2027,
      "series": "world_marathon_majors",
      "seriesStatus": "major",
      "order": 3,
      "entryState": "open",
      "entryNoun": "ballot",
      "hasPublicBallot": true,
      "city": "London",
      "region": "London",
      "country": "United Kingdom",
      "countryCode": "GB",
      "timeZone": "Europe/London",
      "raceDate": "2027-04-24",
      "raceEndDate": "2027-04-25",
      "officialUrl": "https://www.tcslondonmarathon.com/",
      "entryUrl": "https://www.tcslondonmarathon.com/",
      "path": "events/london-2027/",
      "milestoneId": "ballot-open",
      "type": "ballot_open",
      "label": "Ballot opens",
      "at": "2026-04-24T09:00:00+01:00",
      "end": null,
      "endLabel": null,
      "date": "2026-04-24",
      "endDate": null,
      "precision": "instant",
      "confidence": "official",
      "primary": true,
      "note": "Opened at 09:00 British Summer Time on Friday 24 April 2026.",
      "sourceUrl": "https://www.londonmarathonevents.co.uk/london-marathon/article/ballot-2027-tcs-london-marathon-open-friday-24-april"
    },
    {
      "eventId": "london-2027",
      "eventName": "TCS London Marathon",
      "shortName": "London",
      "edition": 2027,
      "series": "world_marathon_majors",
      "seriesStatus": "major",
      "order": 3,
      "entryState": "open",
      "entryNoun": "ballot",
      "hasPublicBallot": true,
      "city": "London",
      "region": "London",
      "country": "United Kingdom",
      "countryCode": "GB",
      "timeZone": "Europe/London",
      "raceDate": "2027-04-24",
      "raceEndDate": "2027-04-25",
      "officialUrl": "https://www.tcslondonmarathon.com/",
      "entryUrl": "https://www.tcslondonmarathon.com/",
      "path": "events/london-2027/",
      "milestoneId": "ballot-close",
      "type": "ballot_close",
      "label": "Ballot closes",
      "at": "2026-05-01T16:00:00+01:00",
      "end": null,
      "endLabel": null,
      "date": "2026-05-01",
      "endDate": null,
      "precision": "instant",
      "confidence": "official",
      "primary": true,
      "note": "Closed at 16:00 British Summer Time on Friday 1 May 2026.",
      "sourceUrl": "https://www.londonmarathonevents.co.uk/london-marathon/article/ballot-2027-tcs-london-marathon-open-friday-24-april"
    },
    {
      "eventId": "cape-town-2027",
      "eventName": "Sanlam Cape Town Marathon",
      "shortName": "Cape Town",
      "edition": 2027,
      "series": "world_marathon_majors",
      "seriesStatus": "major",
      "order": 4,
      "entryState": "decided",
      "entryNoun": "ballot",
      "hasPublicBallot": true,
      "city": "Cape Town",
      "region": "Western Cape",
      "country": "South Africa",
      "countryCode": "ZA",
      "timeZone": "Africa/Johannesburg",
      "raceDate": "2027-05-23",
      "raceEndDate": null,
      "officialUrl": "https://capetownmarathon.com/",
      "entryUrl": "https://capetownmarathon.com/",
      "path": "events/cape-town-2027/",
      "milestoneId": "ballot-open",
      "type": "ballot_open",
      "label": "Ballot opens",
      "at": "2026-06-10T00:00:00+02:00",
      "end": null,
      "endLabel": null,
      "date": "2026-06-10",
      "endDate": null,
      "precision": "day",
      "confidence": "reported",
      "primary": true,
      "note": "The 2027 ballot opened on 10 June 2026. The hour is not stored.",
      "sourceUrl": "https://capetownmarathon.com/"
    },
    {
      "eventId": "cape-town-2027",
      "eventName": "Sanlam Cape Town Marathon",
      "shortName": "Cape Town",
      "edition": 2027,
      "series": "world_marathon_majors",
      "seriesStatus": "major",
      "order": 4,
      "entryState": "decided",
      "entryNoun": "ballot",
      "hasPublicBallot": true,
      "city": "Cape Town",
      "region": "Western Cape",
      "country": "South Africa",
      "countryCode": "ZA",
      "timeZone": "Africa/Johannesburg",
      "raceDate": "2027-05-23",
      "raceEndDate": null,
      "officialUrl": "https://capetownmarathon.com/",
      "entryUrl": "https://capetownmarathon.com/",
      "path": "events/cape-town-2027/",
      "milestoneId": "ballot-close",
      "type": "ballot_close",
      "label": "Ballot closes",
      "at": "2026-06-24T00:00:00+02:00",
      "end": null,
      "endLabel": null,
      "date": "2026-06-24",
      "endDate": null,
      "precision": "day",
      "confidence": "reported",
      "primary": true,
      "note": "The 2027 ballot closed on 24 June 2026. The hour is not stored.",
      "sourceUrl": "https://capetownmarathon.com/"
    },
    {
      "eventId": "cape-town-2027",
      "eventName": "Sanlam Cape Town Marathon",
      "shortName": "Cape Town",
      "edition": 2027,
      "series": "world_marathon_majors",
      "seriesStatus": "major",
      "order": 4,
      "entryState": "decided",
      "entryNoun": "ballot",
      "hasPublicBallot": true,
      "city": "Cape Town",
      "region": "Western Cape",
      "country": "South Africa",
      "countryCode": "ZA",
      "timeZone": "Africa/Johannesburg",
      "raceDate": "2027-05-23",
      "raceEndDate": null,
      "officialUrl": "https://capetownmarathon.com/",
      "entryUrl": "https://capetownmarathon.com/",
      "path": "events/cape-town-2027/",
      "milestoneId": "payment",
      "type": "payment",
      "label": "Race fee charged",
      "at": "2026-06-26T00:00:00+02:00",